{
  "class_tag_vocab_version": "1.0.0",
  "coverage": {
    "class_tag_fraction": 0.433333,
    "module_stage_fraction": 1.0,
    "operation_accounted_fraction": 1.0,
    "operation_stage_fraction": 1.0,
    "parameter_accounted_fraction": 1.0,
    "parameter_stage_fraction": 1.0,
    "verified_module_fraction": 0.433333
  },
  "domain": "text",
  "entities": {
    "graph-input": {
      "confidence": "verified_rule",
      "entity_id": "graph-input",
      "entity_kind": "graph_input",
      "graph_position": {
        "order": 0,
        "total": 95
      },
      "importance": "primary",
      "input_shapes": [],
      "input_tensor_ids": [],
      "interface_signature": "Model inputs",
      "output_shapes": [
        [
          3,
          5
        ]
      ],
      "output_tensor_ids": [
        "tensor-000000"
      ],
      "primary_tag": "input",
      "provenance": [
        "graph_boundary_rule",
        "trace"
      ],
      "qualified_name": "<root>",
      "semantic_name": "Model input",
      "source_class": "transformers.models.esm.modeling_esm.EsmModel",
      "source_name": "Model inputs",
      "source_ref": {
        "end_line": 768,
        "executed_line": 695,
        "file": "transformers/utils/generic.py",
        "source_uid": "source.sha256.254d4da4849c048a7bfc98b1244baf38c6adcf32df8b0cd035ba5ecc314bb1e6",
        "start_line": 695,
        "symbol": "EsmModel.forward"
      },
      "stage_id": "stage-000-input-adapter",
      "tags": [
        "input"
      ],
      "what": "Introduces an input representation to the traced model. Exact source: Model inputs."
    },
    "graph-output": {
      "confidence": "verified_rule",
      "entity_id": "graph-output",
      "entity_kind": "graph_output",
      "graph_position": {
        "order": 64,
        "total": 95
      },
      "importance": "primary",
      "input_shapes": [
        [
          3,
          5,
          16
        ],
        [
          3,
          16
        ]
      ],
      "input_tensor_ids": [
        "tensor-000056",
        "tensor-000061"
      ],
      "interface_signature": "Model outputs",
      "output_shapes": [],
      "output_tensor_ids": [],
      "primary_tag": "output_or_head",
      "provenance": [
        "graph_boundary_rule",
        "trace"
      ],
      "qualified_name": "<root>",
      "semantic_name": "Model output or head",
      "source_class": "transformers.models.esm.modeling_esm.EsmModel",
      "source_name": "Model outputs",
      "source_ref": {
        "end_line": 768,
        "executed_line": 695,
        "file": "transformers/utils/generic.py",
        "source_uid": "source.sha256.254d4da4849c048a7bfc98b1244baf38c6adcf32df8b0cd035ba5ecc314bb1e6",
        "start_line": 695,
        "symbol": "EsmModel.forward"
      },
      "stage_id": "stage-009-output-adapter",
      "tags": [
        "output_or_head"
      ],
      "what": "Produces an output representation. Exact source: Model outputs."
    },
    "module-00000": {
      "confidence": "technical_fallback",
      "entity_id": "module-00000",
      "entity_kind": "module",
      "graph_position": {
        "order": 4,
        "total": 95
      },
      "importance": "primary",
      "input_shapes": [
        [
          3,
          5
        ]
      ],
      "input_tensor_ids": [
        "tensor-000000"
      ],
      "interface_signature": "forward(input_ids:positional_or_keyword?, attention_mask:positional_or_keyword?, position_ids:positional_or_keyword?, inputs_embeds:positional_or_keyword?, encoder_hidden_states:positional_or_keyword?, encoder_attention_mask:positional_or_keyword?, kwargs:var_keyword?) -> tuple[torch.Tensor] | transformers.modeling_outputs.BaseModelOutputWithPoolingAndCrossAttentions",
      "output_shapes": [
        [
          3,
          5,
          16
        ],
        [
          3,
          16
        ]
      ],
      "output_tensor_ids": [
        "tensor-000056",
        "tensor-000061"
      ],
      "primary_tag": "other",
      "provenance": [
        "no_exact_interface_rule",
        "trace"
      ],
      "qualified_name": "<root>",
      "semantic_name": "Unclassified component",
      "source_class": "transformers.models.esm.modeling_esm.EsmModel",
      "source_name": "EsmModel",
      "source_ref": {
        "end_line": 768,
        "executed_line": 695,
        "file": "transformers/utils/generic.py",
        "source_uid": "source.sha256.254d4da4849c048a7bfc98b1244baf38c6adcf32df8b0cd035ba5ecc314bb1e6",
        "start_line": 695,
        "symbol": "EsmModel.forward"
      },
      "stage_id": "stage-004-backbone",
      "tags": [
        "other"
      ],
      "what": "Technical fallback: transformers.models.esm.modeling_esm.EsmModel transforms [3, 5] into [3, 5, 16] in the observed trace."
    },
    "module-00001": {
      "confidence": "technical_fallback",
      "entity_id": "module-00001",
      "entity_kind": "module",
      "graph_position": {
        "order": 1,
        "total": 95
      },
      "importance": "primary",
      "input_shapes": [
        [
          3,
          5
        ]
      ],
      "input_tensor_ids": [
        "tensor-000000"
      ],
      "interface_signature": "forward(input_ids:positional_or_keyword?, attention_mask:positional_or_keyword?, position_ids:positional_or_keyword?, inputs_embeds:positional_or_keyword?)",
      "output_shapes": [
        [
          3,
          5,
          16
        ]
      ],
      "output_tensor_ids": [
        "tensor-000012"
      ],
      "primary_tag": "other",
      "provenance": [
        "no_exact_interface_rule",
        "trace"
      ],
      "qualified_name": "embeddings",
      "semantic_name": "Unclassified component",
      "source_class": "transformers.models.esm.modeling_esm.EsmEmbeddings",
      "source_name": "EsmEmbeddings",
      "source_ref": {
        "end_line": 284,
        "executed_line": 237,
        "file": "transformers/models/esm/modeling_esm.py",
        "source_uid": "source.sha256.d0838ccbf714f47d03ae087f79db1c17fbad5859800588f1cccdaec070d25e18",
        "start_line": 237,
        "symbol": "EsmEmbeddings.forward"
      },
      "stage_id": "stage-001-backbone",
      "tags": [
        "other"
      ],
      "what": "Technical fallback: transformers.models.esm.modeling_esm.EsmEmbeddings transforms [3, 5] into [3, 5, 16] in the observed trace."
    },
    "module-00002": {
      "confidence": "verified_rule",
      "entity_id": "module-00002",
      "entity_kind": "module",
      "graph_position": {
        "order": 2,
        "total": 95
      },
      "importance": "secondary",
      "input_shapes": [
        [
          3,
          5
        ]
      ],
      "input_tensor_ids": [
        "tensor-000000"
      ],
      "interface_signature": "forward(input:positional_or_keyword) -> torch.Tensor",
      "output_shapes": [
        [
          3,
          5,
          16
        ]
      ],
      "output_tensor_ids": [
        "tensor-000009"
      ],
      "primary_tag": "embedding_or_projection",
      "provenance": [
        "exact_class_rule",
        "trace"
      ],
      "qualified_name": "embeddings.word_embeddings",
      "semantic_name": "Embedding or projection",
      "source_class": "torch.nn.modules.sparse.Embedding",
      "source_name": "Embedding",
      "source_ref": {
        "end_line": 197,
        "executed_line": 188,
        "file": "torch/nn/modules/sparse.py",
        "source_uid": "source.sha256.5c802735d695144f94c24c7bb95236ec0482a85343bb1ee9edea8965ec01c130",
        "start_line": 188,
        "symbol": "Embedding.forward"
      },
      "stage_id": "stage-002-input-embedding",
      "tags": [
        "embedding_or_projection"
      ],
      "what": "Projects values or channels into another representation width. Exact source: torch.nn.modules.sparse.Embedding. Observed shape: [3, 5] \u2192 [3, 5, 16]."
    },
    "module-00003": {
      "confidence": "technical_fallback",
      "entity_id": "module-00003",
      "entity_kind": "module",
      "graph_position": {
        "order": 1,
        "total": 95
      },
      "importance": "secondary",
      "input_shapes": [],
      "input_tensor_ids": [],
      "interface_signature": "forward(input:positional_or_keyword) -> torch.Tensor",
      "output_shapes": [],
      "output_tensor_ids": [],
      "primary_tag": "other",
      "provenance": [
        "no_exact_interface_rule",
        "trace"
      ],
      "qualified_name": "embeddings.dropout",
      "semantic_name": "Unclassified component",
      "source_class": "torch.nn.modules.dropout.Dropout",
      "source_name": "Dropout",
      "source_ref": {
        "end_line": 73,
        "executed_line": 69,
        "file": "torch/nn/modules/dropout.py",
        "source_uid": "source.sha256.3b235a9a887ac94c9925a4ec4bfe7b6e2fc69e61a6dd57fe7dd790fc37d54a2d",
        "start_line": 69,
        "symbol": "Dropout.forward"
      },
      "stage_id": "stage-001-backbone",
      "tags": [
        "other"
      ],
      "what": "Technical fallback: torch.nn.modules.dropout.Dropout is present in the traced module hierarchy."
    },
    "module-00004": {
      "confidence": "verified_rule",
      "entity_id": "module-00004",
      "entity_kind": "module",
      "graph_position": {
        "order": 2,
        "total": 95
      },
      "importance": "secondary",
      "input_shapes": [
        [
          3,
          5
        ]
      ],
      "input_tensor_ids": [
        "tensor-000007"
      ],
      "interface_signature": "forward(input:positional_or_keyword) -> torch.Tensor",
      "output_shapes": [
        [
          3,
          5,
          16
        ]
      ],
      "output_tensor_ids": [
        "tensor-000011"
      ],
      "primary_tag": "embedding_or_projection",
      "provenance": [
        "exact_class_rule",
        "trace"
      ],
      "qualified_name": "embeddings.position_embeddings",
      "semantic_name": "Embedding or projection",